{
  "$schema": "./schema/routes.schema.json",
  "source": "OSRM (router.project-osrm.org) – dữ liệu đường © OpenStreetMap contributors (ODbL)",
  "generated": "2026-10-08",
  "ids": [
    "vinh-ha-long",
    "sa-pa",
    "ha-noi",
    "ninh-binh",
    "ha-giang",
    "ban-gioc",
    "cat-ba",
    "mu-cang-chai",
    "hue",
    "phong-nha",
    "da-nang",
    "hoi-an",
    "nha-trang",
    "da-lat",
    "mui-ne",
    "quy-nhon",
    "phu-yen",
    "sai-gon",
    "can-tho",
    "phu-quoc",
    "vung-tau",
    "chau-doc",
    "con-dao",
    "moc-chau",
    "pu-luong",
    "ly-son",
    "buon-ma-thuot",
    "ha-tien",
    "tay-ninh",
    "ninh-thuan",
    "co-to",
    "mang-den",
    "mai-chau",
    "ca-mau",
    "tam-dao",
    "binh-lieu",
    "nam-du",
    "ba-be"
  ],
  "km": [
    [0, 480, 170, 190, 495, 325, 100, 455, 760, 580, 860, 890, 1365, 1490, 1585, 1170, 1240, 1590, 1705, 1690, 1680, 1630, 1795, 365, 315, 995, 1365, 1615, 1515, 1460, 80, 1130, 315, 1940, 240, 100, 1710, 370],
    [480, 0, 315, 405, 375, 520, 460, 135, 975, 795, 1075, 1100, 1580, 1705, 1795, 1385, 1455, 1805, 1920, 1905, 1895, 1840, 2010, 320, 415, 1210, 1580, 1830, 1730, 1675, 560, 1340, 365, 2155, 280, 565, 1925, 325],
    [170, 315, 0, 95, 395, 320, 150, 285, 665, 485, 770, 795, 1270, 1400, 1490, 1080, 1145, 1495, 1610, 1595, 1585, 1535, 1700, 185, 180, 900, 1270, 1520, 1420, 1370, 250, 1035, 140, 1845, 75, 255, 1615, 210],
    [190, 405, 95, 0, 490, 405, 165, 365, 575, 390, 675, 700, 1175, 1305, 1395, 985, 1050, 1400, 1515, 1500, 1490, 1440, 1605, 190, 135, 805, 1175, 1425, 1325, 1275, 265, 940, 140, 1750, 165, 275, 1525, 305],
    [495, 375, 395, 495, 0, 260, 540, 415, 1105, 925, 1205, 1235, 1710, 1835, 1925, 1515, 1585, 1935, 2050, 2035, 2025, 1970, 2140, 515, 540, 1340, 1710, 1960, 1860, 1805, 510, 1470, 490, 2285, 380, 450, 2055, 205],
    [325, 520, 320, 405, 260, 0, 415, 555, 975, 795, 1075, 1105, 1580, 1705, 1795, 1385, 1455, 1805, 1920, 1905, 1895, 1840, 2010, 505, 490, 1210, 1580, 1830, 1730, 1675, 345, 1340, 455, 2155, 360, 280, 1925, 210],
    [100, 460, 150, 165, 540, 415, 0, 435, 740, 560, 840, 870, 1345, 1470, 1560, 1150, 1220, 1570, 1685, 1670, 1660, 1605, 1775, 345, 290, 975, 1345, 1595, 1495, 1440, 180, 1105, 295, 1920, 220, 185, 1690, 355],
    [460, 135, 285, 375, 415, 555, 440, 0, 925, 745, 1030, 1055, 1530, 1660, 1750, 1340, 1405, 1755, 1870, 1855, 1845, 1795, 1960, 220, 330, 1160, 1530, 1780, 1680, 1625, 540, 1295, 280, 2105, 270, 545, 1875, 365],
    [765, 980, 670, 575, 1110, 980, 745, 930, 0, 215, 95, 125, 600, 725, 815, 405, 475, 945, 1110, 1155, 1000, 995, 1160, 730, 615, 230, 600, 1080, 880, 695, 845, 360, 655, 1345, 760, 850, 1175, 880],
    [585, 800, 485, 395, 925, 800, 560, 750, 215, 0, 315, 340, 820, 945, 1035, 625, 695, 1080, 1195, 1275, 1170, 1120, 1285, 550, 430, 445, 820, 1205, 1005, 915, 660, 580, 475, 1430, 580, 665, 1295, 700],
    [865, 1085, 770, 675, 1210, 1080, 845, 1030, 95, 315, 0, 30, 500, 625, 715, 305, 375, 860, 1025, 1230, 900, 1075, 1070, 835, 715, 135, 515, 1160, 850, 595, 945, 275, 755, 1260, 865, 950, 1255, 985],
    [895, 1110, 795, 705, 1235, 1110, 870, 1060, 125, 345, 30, 0, 485, 610, 700, 290, 360, 850, 1015, 1225, 885, 1065, 1065, 860, 740, 120, 535, 1150, 840, 580, 970, 260, 785, 1250, 890, 975, 1245, 1010],
    [1370, 1590, 1275, 1185, 1715, 1585, 1350, 1535, 600, 820, 500, 485, 0, 135, 225, 215, 155, 415, 585, 810, 405, 655, 635, 1340, 1220, 395, 190, 740, 510, 105, 1450, 405, 1260, 820, 1370, 1455, 835, 1490],
    [1495, 1715, 1400, 1310, 1840, 1715, 1475, 1660, 730, 945, 630, 610, 135, 0, 155, 340, 280, 295, 465, 690, 325, 530, 515, 1465, 1345, 520, 195, 615, 380, 105, 1575, 450, 1390, 700, 1495, 1580, 710, 1615],
    [1585, 1805, 1490, 1400, 1930, 1805, 1565, 1750, 820, 1035, 720, 705, 225, 155, 0, 430, 370, 190, 360, 590, 185, 430, 410, 1555, 1435, 610, 355, 520, 285, 125, 1665, 615, 1480, 600, 1585, 1670, 610, 1705],
    [1180, 1395, 1085, 990, 1520, 1395, 1160, 1345, 410, 630, 310, 295, 215, 340, 430, 0, 80, 620, 790, 1020, 615, 860, 840, 1145, 1030, 205, 265, 945, 610, 310, 1255, 265, 1070, 1025, 1175, 1265, 1040, 1295],
    [1245, 1465, 1150, 1060, 1590, 1465, 1225, 1410, 475, 695, 380, 360, 155, 280, 370, 80, 0, 560, 730, 960, 555, 800, 780, 1215, 1095, 270, 220, 885, 565, 250, 1325, 330, 1135, 965, 1245, 1330, 980, 1365],
    [1590, 1805, 1495, 1400, 1930, 1805, 1570, 1755, 945, 1080, 860, 850, 415, 290, 190, 620, 560, 0, 175, 400, 95, 240, 225, 1555, 1440, 785, 355, 330, 95, 315, 1665, 620, 1480, 410, 1585, 1675, 420, 1705],
    [1705, 1920, 1610, 1515, 2045, 1920, 1680, 1870, 1105, 1195, 1020, 1015, 585, 465, 360, 785, 730, 175, 0, 280, 255, 125, 105, 1670, 1550, 945, 520, 210, 230, 480, 1780, 785, 1595, 245, 1700, 1790, 300, 1820],
    [1690, 1910, 1595, 1505, 2035, 1910, 1670, 1855, 1150, 1275, 1230, 1220, 810, 690, 590, 1015, 955, 400, 275, 0, 485, 160, 345, 1660, 1540, 1155, 725, 75, 355, 710, 1770, 995, 1580, 390, 1690, 1775, 40, 1810],
    [1680, 1900, 1585, 1490, 2025, 1895, 1660, 1845, 1000, 1170, 900, 885, 410, 325, 185, 610, 555, 95, 255, 485, 0, 325, 305, 1650, 1530, 795, 410, 415, 195, 305, 1760, 670, 1570, 495, 1680, 1765, 505, 1800],
    [1625, 1845, 1530, 1440, 1970, 1845, 1605, 1795, 995, 1120, 1075, 1065, 655, 530, 430, 860, 800, 240, 120, 160, 325, 0, 220, 1595, 1475, 1000, 570, 90, 200, 555, 1705, 835, 1520, 350, 1625, 1710, 180, 1745],
    [1795, 2010, 1700, 1605, 2135, 2010, 1770, 1960, 1155, 1285, 1070, 1065, 635, 515, 410, 835, 780, 225, 105, 345, 305, 230, 0, 1760, 1640, 995, 570, 275, 290, 530, 1870, 835, 1685, 230, 1790, 1880, 370, 1910],
    [360, 320, 185, 190, 515, 505, 340, 220, 730, 545, 830, 855, 1335, 1460, 1550, 1140, 1210, 1555, 1670, 1660, 1645, 1595, 1760, 0, 110, 960, 1335, 1585, 1480, 1430, 440, 1095, 60, 1910, 210, 445, 1680, 380],
    [310, 415, 180, 135, 540, 495, 290, 330, 610, 430, 710, 740, 1215, 1340, 1430, 1020, 1090, 1440, 1555, 1540, 1530, 1475, 1645, 110, 0, 845, 1215, 1465, 1365, 1310, 390, 975, 50, 1790, 230, 395, 1560, 385],
    [1005, 1220, 910, 815, 1345, 1220, 980, 1170, 235, 455, 135, 120, 395, 520, 610, 200, 270, 785, 950, 1155, 795, 1000, 995, 970, 850, 0, 445, 1085, 775, 490, 1080, 170, 895, 1185, 1000, 1090, 1180, 1120],
    [1375, 1595, 1280, 1185, 1720, 1590, 1355, 1540, 605, 825, 520, 535, 190, 195, 355, 265, 220, 355, 520, 730, 415, 570, 570, 1345, 1225, 445, 0, 660, 345, 285, 1455, 280, 1265, 755, 1375, 1460, 750, 1495],
    [1620, 1835, 1525, 1430, 1960, 1835, 1595, 1785, 1080, 1205, 1160, 1150, 740, 615, 515, 945, 885, 330, 205, 75, 415, 90, 275, 1585, 1465, 1085, 655, 0, 285, 640, 1695, 920, 1510, 320, 1615, 1705, 95, 1735],
    [1515, 1730, 1420, 1325, 1860, 1730, 1495, 1680, 880, 1005, 850, 840, 510, 380, 285, 610, 565, 95, 230, 355, 190, 200, 285, 1480, 1365, 775, 345, 285, 0, 410, 1590, 610, 1405, 470, 1510, 1600, 380, 1630],
    [1465, 1685, 1370, 1280, 1810, 1685, 1445, 1630, 695, 915, 600, 580, 105, 105, 125, 310, 250, 315, 485, 710, 305, 555, 530, 1435, 1315, 490, 285, 640, 410, 0, 1545, 500, 1355, 720, 1465, 1550, 730, 1585],
    [80, 560, 250, 265, 510, 345, 180, 535, 840, 660, 940, 970, 1445, 1570, 1660, 1250, 1320, 1670, 1785, 1770, 1760, 1705, 1875, 440, 390, 1075, 1445, 1695, 1595, 1540, 0, 1205, 395, 2020, 320, 110, 1790, 405],
    [1145, 1365, 1050, 955, 1490, 1360, 1125, 1310, 375, 595, 275, 260, 405, 450, 620, 260, 330, 620, 785, 995, 680, 835, 835, 1115, 995, 170, 280, 925, 610, 500, 1225, 0, 1035, 1020, 1145, 1230, 1015, 1265],
    [315, 365, 140, 140, 490, 455, 290, 280, 655, 470, 755, 780, 1255, 1385, 1475, 1065, 1130, 1480, 1595, 1580, 1570, 1520, 1685, 60, 50, 885, 1255, 1505, 1405, 1355, 390, 1020, 0, 1830, 165, 400, 1605, 330],
    [1940, 2155, 1845, 1750, 2285, 2155, 1920, 2105, 1345, 1430, 1260, 1250, 820, 700, 595, 1025, 965, 410, 245, 390, 490, 360, 230, 1905, 1790, 1185, 755, 320, 470, 720, 2020, 1020, 1830, 0, 1935, 2025, 410, 2055],
    [240, 280, 75, 165, 380, 360, 220, 270, 760, 575, 860, 885, 1365, 1490, 1580, 1170, 1240, 1585, 1700, 1690, 1675, 1625, 1795, 210, 230, 990, 1365, 1615, 1510, 1460, 320, 1125, 165, 1940, 0, 325, 1710, 195],
    [100, 565, 255, 270, 450, 280, 185, 540, 845, 665, 945, 975, 1450, 1575, 1665, 1255, 1325, 1675, 1790, 1775, 1765, 1715, 1880, 450, 400, 1080, 1450, 1700, 1600, 1545, 110, 1215, 400, 2025, 325, 0, 1795, 345],
    [1715, 1930, 1620, 1525, 2055, 1930, 1690, 1880, 1175, 1295, 1250, 1245, 835, 710, 610, 1035, 980, 420, 300, 40, 505, 180, 370, 1680, 1560, 1180, 750, 95, 375, 730, 1790, 1015, 1605, 410, 1710, 1800, 0, 1830],
    [375, 325, 215, 310, 205, 210, 355, 360, 880, 700, 980, 1010, 1485, 1610, 1700, 1290, 1360, 1710, 1825, 1810, 1800, 1745, 1915, 380, 390, 1115, 1485, 1735, 1635, 1580, 405, 1245, 330, 2060, 195, 345, 1830, 0]
  ],
  "hours": [
    [0, 6.25, 2.25, 2.5, 6.25, 4.5, 1.75, 5.75, 10, 7.75, 11.5, 11.75, 17.75, 19.75, 20.75, 15.25, 16.25, 20, 22.25, 31.5, 21.5, 21.25, 23.25, 4.75, 4, 13, 18.5, 22, 19.25, 19, 9.5, 14.75, 4, 25, 3, 1.5, 32, 4.5],
    [6.25, 0, 4.25, 5.25, 4.5, 6.25, 6.25, 1.75, 12.75, 10.5, 14, 14.5, 20.5, 22.5, 23.25, 17.75, 19, 22.75, 24.75, 34.25, 24.25, 23.75, 26, 4.5, 6, 15.75, 21.25, 24.75, 22, 21.75, 15.25, 17.25, 5, 27.75, 4, 7.25, 34.75, 4.25],
    [2, 4.25, 0, 1.25, 5, 4.25, 2.25, 3.5, 8.75, 6.5, 10.25, 10.5, 16.5, 18.5, 19.5, 14, 15, 19, 21, 30.25, 20.25, 20, 22, 2.75, 2.5, 12, 17.25, 20.75, 18, 17.75, 11.25, 13.5, 2, 23.75, 1, 3, 30.75, 2.75],
    [2.5, 5.5, 1.25, 0, 6.25, 5.25, 2.5, 4.75, 7.75, 5.5, 9, 9.25, 15.5, 17.5, 18.25, 12.75, 14, 17.75, 19.75, 29.25, 19, 18.75, 20.75, 2.5, 1.75, 10.75, 16, 19.75, 16.75, 16.5, 11.5, 12.25, 1.75, 22.5, 2.25, 3.25, 29.75, 4],
    [6.25, 4.5, 5, 6.25, 0, 3, 7, 5, 13.75, 11.5, 15, 15.5, 21.5, 23.5, 24.25, 18.75, 20, 23.75, 25.75, 35.25, 25.25, 24.75, 27, 6.75, 7, 16.75, 22, 25.75, 22.75, 22.75, 14.75, 18.25, 6, 28.75, 4.75, 5.75, 35.75, 2.5],